tweet_stemmed;target_new
presiden vaksinasi provinsi banten gencar arusbaik vaksinasi;1
bikin story nunggu antri vaksin pas vaksin kemarin puskesmas langsung suruh tensi habis langsung suntik;1
kecundang vaksin pasal;0
ydzuha semangat vaksin;1
nazzhr ws vaksin;1
gimana ya takut ga sertif vaksin vaksin do beda lokasi;0
vaksin moderna moga panas ;1
enam udah steril berat tau kalo vaksin dokter vaksin kalo kucing vaksin nginep sana puasa steril;1
senin vaksin pfizer selasa tumbang rabu normal ;1
udah vaksin habis vaksin pusing banget ya ;0
cepat dapat vaksin kena duduk cebik camni httpstcowvwcixzab;1
mak dah marah kejap tangguh vaksin kejap kena ambik vaksin moga kalini kena scam cikgu sekolah   ;0
mynmeisf zarazettirazr jual vaksin gratis dr who aja teh psti untung gede kaya bsa lngsung nglonjak loh;0
maless bgt kalo udah vaksin nunggunya hhhh ngantuk pls;0
keluarga vaksin pertamq lgsg gk ena badan  w doank yg beda pas vaksin meriang nya cuman bbrp jam doank nya tdr mulu ;0
yey selesai vaksin sy antuk;1
karirfess coba tunggu deh sampe minggu vaksin;1
ni abis vaksin sakit;0
takut nak vaksin esok;0
weh takut jarum lepastu kawan dah vaksin pergi takut takut  ;0
abis vaksin rada rada sumeng dikit udah mending alhamdulillah im strong hyzaaa;1
sial gue degdegan dahal vaksin ;0
w udh vaksin x tp sertifikat vaksin w gk nongol peduli lindung  gimana nonton bioskop coba ;0
moga vaksin;1
daerah hak vaksin serbuanvaksinasi slw pangdam siliwangi luncur vaksinasi wilayah isolasi d  httpstcohotjetokpj;1
indonesia terima vaksin covid juta dosis httpsbaperanewscomindonesiakembaliterimavaksincovidsebanyakjutadosis nestle  capai herd immunity pon xx papua bangtan live box misterius erick thohir allrounderjinyoungday;1
gitajisung w vaksin sekul org huhu malu bgtt gtlt;1
engga gel vaksin;1
plindungi kak ayah udah minggu sertif vaksin coba call cs nih kak customer service nomor hubung;0
indonesia terima vaksin covid juta dosis httpsbaperanewscomindonesiakembaliterimavaksincovidsebanyakjutadosis jkwetmajukankrakatausteel percepatkekebalankomunal ppkmmembawadampakbaik usaha mandiri utksemua stopfitnahfpi bangga juang syariah megan ikon made me proud allrounderjinyoungday;1
darjofess vaksin masmbak e;1
indonesia terima vaksin covid juta dosis httpsbaperanewscomindonesiakembaliterimavaksincovidsebanyakjutadosis  syariahsumberkeberkahan lee jeno thank you semuamakinmudah starsforseungmin dakwahsyariahislam tinggal vaksin lindung indonesia partai plnmobile;1
restamojokerto vaksin cepat kebal komunal;1
jaemcityx blum pulang vaksin ngantuk bgt  ;1
ask udh vaksin dosis tp sertifikat nya gak muncul ya apk nunggu bbrp makasih yaaa;1
sumprit berita keren banget terima kasih jokowi ayo dukung upaya perintah kalah si covid tingkatin disiplin prokes ikut vaksin lupa wooyy masker wooyy   ;1
restamojokerto ayo vaksin biar kebal;1
yall otw nak vaksin;1
gue besok vaksin deg degan  ;1
pagi vaksin moderna pas suntik ga sakit yg ngantuk laper yg bayang otak makan aja ;1
restamojokerto ayo vaksin;1
vaksin capa herd immunity kebal tubuh virus covid ayo dulur vaksin percepatkekebalankomunal capai herd immunity;1
vaksin sakit ya ky digegel biawak;0
humasrestuban lupa vaksin ya percepatkekebalankomunal capai herd immunity;1
andeloemoet vaksin;1
lusa vaksin beli eskrim moga g demam;1
karinaaein udah vaksin;1
chip vaksin kemarin kepake;1
abis vaksin;1
rainnygun iya cb aja kl gasibuk kl ga ya kirim email kl msh gbs cb tempat vaksin jannn tugas baik gmn;1
haiigue selesai vaksin;1
abis vaksin skrng sy ngantuk bgt;1
annisasa pengarangsajak triwul nakula datang vaksin salah wujud hasil upaya diplomasi perintah;1
kaum antivax protes usaha yg terap bijak mandatory vaksin requirement hiring nya karyawan adl aset usaha hak lindung kerja nya ga suka bijak tsb silah carilamar usaha yg simple;0
polri gelar vaksinasi massal dosis gerai vaksinasi masyarakat vaksin covid gratis percepatkekebalankomunal capai herd immunity;1
sobat vaksin ayo sob laku vaksinasi vaksin syarat utama pergi vaksin jaga protokol sehat sehat sehat vaksincovid ayovaksin takesyoueverywhere;1
aja selesai vaksin dosis moderna puskesmas telat jadwal asli rada kecewa sih ga ya gimana stock dosis nya ready h puskesmas vaksin dosis ga usaha jemput bola;0
hndk vaksin pdhl beisukan td sungsung sekali malam td jam haur mauk ja kepala lwn muntah pdhl sdh nukar susu beruang jua;0
beli cilok aja nunjukin vaksin mah;0
bertanyarl alhamdulillaaaah tetep jaga prokesnya tementemen vaksin ya ;1
tolong henti bodoh wajib vaksin selesai kipi jadi ikut pasca imunisasi klo v  httpstcoijgtvvv;0
jam vaksin nd doses bekas sunti rasa gel laper banget kelar makan ngantuk super kenyang sakit kelar makan;0
vaksin vaksin migrain konsisten sih;0
sekretariatumum vaksin kebal tubuh;1
mau moderna nakes aja blm booster bossvaksin baik yg sedia pilih vaksin keduluan virus aktif rasa;0
heeseungjawa asli sebel bgt gamau vaksin rugi orang;0
daisyndelions happy st dose alin waa comelnyaa  i nak bawak chenle gi vaksin hehe ;1
annisasa pengarangsajak sahabatsaber yradianto ayo dukung vaksin nusantara;1
stanmenfess dpt vaksin ga efek nder lengan kaya ditampol orang lurah;1
ye covid konspirasi nk lenyap golong bodoh sombong bangang muka bumi ni dh terang statistik anti vaks mati lbh ramai dr vaksin lg bangang jd mmg bagus la org mcm anti vaks ni cpt hapus dr bumi ni;0
undang gada samasekali jam vaksin alhasil pake berangkat jam yg kaya vaksin aja jam pagi jadwal vaksin hari daftar vaberaya khusus vaksin puskesmas dosis jadwal vaksin vaksin lurah pake kupon;0
kabar gembira diri vaksin x dosis lengkap tempat puskesmas dekat alias meter rumah ;1
besok vaksin tp ni badan lemes sakit duh;0
setkabgoid vaksin cepat milih ditangerang bojong nangka kelapa pake kk yg musti dukcapilnyakalau bisabelum mundar mandir ribet banget sihyg mudah musti sulit ktp sdh;1
gue aja vaksin efek jd ngantuk bgt anjir;0
suyiesw bekas vaksin sakit banget men pdhal bru yg;0
polri gelar vaksinasi massal dosis gerai vaksinasi masyarakat vaksin covid gratis percepatkekebalankomunal capai herd immunity;1
susah jelasinnya dah vaksin gapenting sih;1
jullieid dkurooo emang cepet cepet vaksin u kek;1
pamit vaksin kasih amplop jajan jalan trus habis vaksin suruh langsung pulang aja gausah kerja kalo gin vaksin kali gpp ;1
weishenv yangyang habis vaksin gemes bgt ;1
bangkit marah rakyat hukum antivaksin harap bawah pimpin raja skg laku kejam yg nyata wajib;0
lunaandhelios iyap bener vaksin bener tolong banget sih weh jd jinjin nggak lg udah vaksin;1
godplsforgiveus amamacay nyebut nomer antri vaksin mah;1
buru vaksin yg biar temennya httpstconikgdaoqtf;0
habis vaksin baperan ya;0
ajengristia kalo gue emang angka sakit orang udah kurang drastis dulunya taku  httpstcouiglanfnop;1
ympenyapu nak nak kena terima la kesan vaksin ni terima kasih;1
plindungi min sy gbisa akses salah nik pas sy cek nik yg tercantim lembar data pd vaksin tulis ksalahan no pd nik sy udj x email email plindungi blm response mohon bantu gimanabutuh bukti sertifikat udh vaksin nih makasih;0
reefqieee vaksin kat sekolah  ;0
drkoko lanunatuna type vaksin;0
bioskop yg udah vaksin kali;1
sygfess lgsg aja nder abis vaksin tu beli gelato;1
oh adek abis vaksin ngilu ngilu dah tuh tangan ;0
eropa mandatori vaksin masuk restoran lawan turun jalan wakanda yg rakyat buih yg tidur pulas sadar mimpi   ;1
kayak emang sengaja ken covid dilanjutin deh sd yg bocah bom vaksin buka;0
habis vaksin covid efek samping antibodi httpstcoxgomlgkqm;1
bertanyarl dibeliin sempolan pas bantu vaksin httpstcokqwtxjacw;1
le kau kandung amp anak anak kau anak kau duduk asrama je ambil vaksin tu;1
yangbikinkangen tes hasil bu udah vaksin kemarin;1
dis kabar;1
giat aman jalur rute rombong tamu vip pemda jalur vaksin kota pontianak situasi aman lancar poldakalbarberkibar polreskuburayabersinar polsekwasbandarasupadio;1
perintah tambah sedia vaksin covid terima datang vaksin tahap dosis vaksin lengkap   vaksin;0
giat vaksin serentak smpn takokak humas polres cianjur polres cianjur;1
abis vaksin tangan gue jdi gel  ;1
vaksin yaa;1
ga cerita moga karna cegah muncul paranoid kalang butuh pasti sih sebab pasti sakit vaksin;1
rabu tgl september babinsa koramil kb kodim ssd serda supriyanto laksana giat damping vaksin sma negeri koto kec koto kab dharmasraya;1
ramai pergi ambik vaksin ni ;0
yourgurlpiiio udah kebal vaksin;0
gak ya vaksin udah astra vaksin pfizer kalo bgt dh;1
asa vaksin udah berharihari tangan gel ya;0
kemenkes arab saudi izin terima vaksin sinovac laksana umrah syarat penuh jamaah;0
bile la nak selesai isu vaksin mysejahtera niedah la hantar emailnak tunggu balas kerja;0
waytotheclty kau vaksin;0
lingkung iain syaikh abdurrahman siddik bangka belitung rabu september vaksinasi laksana wib sd selesai gedung padu iain syaikh abdurrahman siddik bangka belitung vaksinasi kali laksana lantar vaksin;1
vaksinasi merdeka serentak polda riau gandeng guru siap vaksin paket bansos httpdlvritspt;1
drkoko dok tgl jadwal vaksin pfiezer yg skrg lg haid anemia tunda minggu kah;1
watchmenid min atur ibadah ntn skr kudu vaksin x ya yg blm ntn bener min;0
bekasibase sepupu w taun vaksin tnpa ktp;0
pas ngantri vaksin hehe;1
lg vaksin eh g dpt no antri dah;0
napa sertifikat vaksin gua ga nongol peduli lindung woyyy;1
aslinyaduaorang ijinnya pagi pas jam vaksin aja;1
sekurangkurangnya remaja umur lingkung terima dos vaksin covid negara malam timbal menteri kesihatan datuk dr noor azmi ghazali vaksincovid kkm keluargamalaysia jabatanpenerangan perlismaju;1
open adopt kucing daerah bintaro toothless udah vaksin xmau kasih niat ngerawat karna rumah udh kucing kucing yg sakit jugawaktu ku rescuekalo yg rawat mention ya  ;1
laksana vaksin mobile poliklinik polres banyuasin pt tbl desaa sidomulyo cair kumbang kabbanyuasin;0
vaksin mahasiswa tatap muka anak sd  ;0
kapolres lampung timur kasdim lamtim ikut vicon vaksin serentak panglima tni kapolri gerai vaksin puskesmas batanghari vaksinasimerdeka covid vaksinserentak divisihumaspolri humaspoldalampung polreslampungtimur httpsinstagrampcuhcxmlzaj;0
humanhybriid blom vaksin;0
adik dah vaksin malam;0
bestnyaa member ramai dah vaksin   ;1
menteri sains teknologi inovasi mosti mantap ekosistem bangun vaksin negara usaha bangun vaksin keluar tempat menteri datuk seri dr adham baba vaksincovid mosti keluargamalaysia jabatanpenerangan perlismaju;1
bhwilayah bekal lali remaja miri sibu httpstcoxsoeldwpfo;1
si bungsu vaksin uhuhuhuuuuuu gmn efek nak ngantuk kah laper trus yangyang ;1
pi vaksin senior jaga kaunter x kena dah adeh ;0
status kini kapasiti guna katil covid beri vaksin kes baharu september kapasiti guna katil covid september pm  guna katil icu  guna katil icu;1
member dpt vaksin   ;1
kjri barcode vaksin covid indonesia baca sistem arab saudi httpsbaperanewscomkjrisebutbarcodevaksincovidindonesiatakterbacadisistemarabsaudi jokowimampukendalikanpandemi ngopidaring belanegara ayu azhari anies unty lesti kejora voucher punya nidji korban box misterius;1
sebab kau dating group submitkena potong markahalasan vaksindey pundei dah esok busy kanina cibaimenyusahkan organk babi nk buatbuto dah degree mcm sial perangai;1
guru tolak vaksin santa menteri;1
kjri barcode vaksin covid indonesia baca sistem arab saudi httpsbaperanewscomkjrisebutbarcodevaksincovidindonesiatakterbacadisistemarabsaudi nasdem capai herd immunity jokowimampukendalikanpandemi rctiplusadagame shopeeitzy jesslyn kek mandalika firda tawar tuips;0
vaksin;0
yangyang  i  ve done my first dose of the vaccine my arm feels sore hahahahaha sleep;0
giat pawas serta piket fungsi laksana patroli vaksin covid puskesmas btkuis;0
nanazzzhh iyadong hbu udah vaksin;1
waytotheclty ih sama jg abis vaksin kiw kiw;0
habromanla vaksin;1
umanpanji partaisocmed kakak udah vaksin kak;0
pas vaksin dapet beras orang kg bareng ayah dapet kg ;0
yeay jumaat vaksin   ;1
ya allah ngantuk banget efek vaksin jadwal jam sampe maghrib kirain gak kelas siang huft i should low mg expectation;1
indonesia terima vaksin covid juta dosis httpsbaperanewscomindonesiakembaliterimavaksincovidsebanyakjutadosis nasdem capai herd immunity jokowimampukendalikanpandemi rctiplusadagame shopeeitzy jesslyn kek mandalika firda tawar tuips;0
smgmenfess mlebu mall nggo sertif vaksin kecuali diri iso ngilang langsung ng xxi;1
waytotheclty ih vaksin;1
vaksin tanam;0
sdh jaman nabi adam turun bumi kopidiot udah aneka penelitan ttg vaksin kopid anak ya mba provax bebal;1
liputandotcom sdh vaksin hrs pake masker ga bebas pergi vaksin ga manjur ato gmn;1
jadual sunti vaksin covid ajar lantan daerah pasir mas bachok atur sekolah bapa jaga cakna twtkelantan negerikelantan kelategomo;1
benerr keluarga ttp yg kena biarin udah full dose vaksin cegah emang tp cegah biar efek ga parah at least hindar angka mati;1
smgmenfess wis buka kudu nunjukke sertifikat vaksin ng gerbang e;1
beks nanya adek ya ken vaksin nunjukin ktp emang kalo bikin ktp surat vaksin gimana si vaksin bikin ktp makasee;0
xxi vaksin gak sie;0
helo kfc utk kfc vaksin promo selfcollect tu kne ambil kat drivethru restaurant shj walkin redeem baucer kt restaurant dekat;0
booster vaksin covid prioritas idap lain imunitas httpstcocxbmnlooxc;1
udah jam vaksin moderna aja vaksin ga dimasukin  ;1
awal negara lengkap sunti httpstcoeecoyufs;1
waytotheclty klo vaksin varian kaya;1
iya sih tp baik sih unjung yg ga bener fit tahan dlu ga bioskop uda vaksin ya baik kalo sampe tutup yg rugi ga bs nonton film bagus bioskop;1
lol my fyp penuh budak kgv ambik vaksin harini shskshsk dah ambik svkjk;1
moviemenfes vaksin;0
syarat masuk indonesia negeri vaksin penuh jalan pcr kali jalan karantina delapan httpbitlynqgq;1
distribusi vaksinsesuai kbutuhan daerah laksana vaksinasi daerah ri masy ri slalu disiplin prokes m kendorabai prokes pandemi kapasitas vaksinasi smg jutajuta stiap cepat herd immunity pandemi smg reda;0
selamat siang kak akusonia dpt informasi utk terbang nusa tenggara timur utk wajib lampir sertifikat vaksin lampir hasil pcr test laku x jam rapid test antigen laku x jam;1
kapolres lampung timur kasdim lamtim ikut vicon vaksin serentak panglima tni kapolri gerai vaksin puskesmas batanghari vaksinasimerdeka covid vaksinserentak divisihumaspolri humaspoldalampung;0
woahh esok amik vaksin sabar huhu  ;0
agakbete vaksin jarum diri liatin buka plastik suntik wkwk;1
rencana besok;0
unit udara jabat bomba selamat malaysia jbpm pangkal miri jalan operasi bawa vaksin jenis pfizer hospital queen elizabeth kota kinabalu sabah pusat farmasi bahagian miri pusat farmasi bahagian sibu httpsutusanborneocommybombabantuterbangkanvaksinkemiridansibu;1
laki vaksin sumpah scary treasure takpe jugak ya allah nervous gila  ;0
korang taknak vaksin pindah duduk korea gitu korea utara camni httpstcouwjxzgsuqi;1
chcocopie hahahahah klau nk cute kene cpt ii vaksin  ;0
kemaren sombong vaksin gak efek vaksin tampar;1
capai vaksin covid sumsel persen pasok batas animo masyarakat;1
sila kunjung taut httpscoronajakartagoididkuotavaksinasijaki kuota vaksin lokasi sesuai saran lokasi sedia;0
bioskop aman ukur risiko banyak reopening kali bioskop vaksin;1
wajib daftar ulang vaksinasi aplikasi jaki pilih tanggal h jadwal tentu kartu vaksin;1
strwberriescgrt pas vaksin gitu nakesnya nyuruh;0
nak vaksin jugaaa   ;1
polres sukoharjo siap ribu dosis vaksin sasar masyarakat desa humas polri httpshumaspolrigoidpolressukoharjosiapkanribudosisvaksinsasarmasyarakatdipedesaan sukoharjo sukoharjomakmur beritasukoharjo;1
info on wheels iow pelan pulih negara fasa vaksin covid amp budaya norma baharu daerah kuala teren  httpstcogdyrvjrgd;1
rencana besok;1
waytotheclty istirahat ya sayang vaksin dosis sakit bgt sampe pingsan   ;1
dimascs wkwkwkwk canda gw vaksin dosis dapet dosis;1
yeyyy yangyang udah vaksin;1
polsek pandih batu cek kontrol simpan vaksin puskesmas pangkoh httpstcolrxxdcgs;1
amsyaralaau bayaseh polis positif dadah pon kena buang ini cikgu vaksin oh negara    ;1
bismillah vaksin check     ;1
yangyang vaksin trus vaksin siih;1
pas vaksin ga enak badan doang pas vaksin pusing ga enak badan klo bediri kleyengan tpi klo tangan gel vaksin si ;0
waytotheclty kemaren vaksin pgn makan ;0
amrrridz kau vaksin pon kau mmg slalu lapar bob;0
hah anjg gw vaksin nya lusa rabuampamp besok anjgg pdhl aja kasih form;1
ya allah cape bgt ngurusin vaksin;1
vaksin pas suntik darah ;1
kapten cpm sayana komandan koramil gondang pasi intel kodim sragen gondang laksana komsos rangka koordinasi vaksin dosis laksana senin tempat bumdes desa kaliwedi camat gondang kabupaten sragen;0
kira tangan bengkak abis vaksin emg gendut aja ;1
kuliah tatap muka umk prioritas vaksin lengkap klik taut kudus kuliah ptm mahasiswa umk;1
legal wkwkwk tinggal tunggu jadwal vaksin   ;1
muchdreamsy bntr vaksin ku dosis;1
yseohui banjarnegara sertifikat vaksin peduli lindung;0
habis vaksin bole olahraga gak sie;0
sunzghooon semangatt abis vaksin lupa istirahat;1
gumballgembel tim belah kalo vaksin langsung suruh cuti ;1
ssssakty yha nama vaksin tetep aja efek bikin tubuh ngga oke dipake hari;1
budi gunadi juta dosis vaksin distribusi daerah httpstcoxcefwhgyz;1
yoojiha ajak kak lgsg bawa temenin vaksin wkwk ;1
bahas vaksin jg koq;1
waytotheclty abis vaksin kl jodoh;1
epiphanylovey besok vaksin sakit ga;1
info on wheels iow pelan pulih negara fasa vaksin covid amp budaya norma baharu daerah kuala nus  httpstcoimskiqgvr;1
folksnghwa yeayyy check in check out pake apps ya udh vaksin lam;0
abis vaksin rasa gel ;1
 why is the holiday over  the holiday overlapped with the second round of vaccine so im in pain for two days   ill cheer up from today  monbebe take a rest until today aww minhyuk  and pls why is speaking so cutely imma cry ;0
waytotheclty cieeeeee udh vaksin tangan letoy sblh kn  ;0
stok vaksin kota cirebon habis dosis tunda httpstcogouoshrbx;0
waytotheclty abis vaksin gak tidur tauuu;1
udah vaksin tau efek nya gel vaksin gak;1
vaksin pas period emang beda ya udah ngantuklaperdileppusing mantap tugas deres wkwkwkw;0
tni al lantamal xii pontianak tinggi animo masyarakat maritim vaksin covid tubuh tim satgas covid lantamal xii bawa komando kepala dinas sehat lantamal xii letkol laut k drg heru subagyo sp pros;1
nobar ptd at cepol detos vaksin dosis boleh dm me for more info tags bts live rm jin suga j  httpstcosrvefjla;0
bajing kartu vaksin gak kanggo masuk mall tai ajing babi pedulilindungi;1
hai tenang kaa tunggu aja sampe vaksin kalo ga web ket kalo telp nyaa;0
 orang kaya kaya banget gitu sampe bioskop kecil rumah beli film gitu tonton rumah ga ya kalo kaya vaksin karna sakit terapi vaksin;1
bg vaksin kat remaja laju gila kat thn keatasadr daftarberjanggut tunggu haamna loop hole nya;1
walk in je la ambik vaksin;1
areajulid moga beneran jdi vaksin aamiin;1
bahas teliti vaksin covid yg sinopharm sinovac hasil teliti update ig nya klo sih bagus orang awam non nakes kayak tau info;0
vaksin dosis operasi wib antre kondisional posisi gate krl ex lokasi genose tarif ribu trims;1
habis vaksin jarum kek asa ;1
yabiasalahh gua blm vaksin;1
individu lengkap vaksinasi terima sijil digital kad vaksin jkjavmy menangbersama lindungidirilindungisemua kitateguhkitamenang komunikasikita psacovidrtm;1
areajulid gue neng jg gue vaksin alas krna susah kerja   tp cari vaksin gratis jakbar;0
tahniah malaysia   capai imuniti kelompok atus duduk dewasa lengkap vaksin vaksin selamat   lindung lindung japensabah komunikasikita menangbersama;1
bareng bu lina jadwal libur pol vaksin    ;1
declarewar to globalist ww antinwo civilsociety urbanpeople survivalist revolution khilafah activist theendtimes islam anonymous antivax palestin biden afghan indonesia news rakyat vaksin malaysia talib hongkong german canada brazil arab australia japan africa;1
ndes udah yg bioskop pakai kartu vaksin ga;1
jlyy ayok vaksin sukseskanvaksinasijawatengah indonesiasehatindonesiahebat;1
badpople knp gjd vaksin;1
sandypiero hahaha nggak udah abis vaksin;1
agakkecoklatan sagitarus nerdylibran itsnotraining maap nimbrung fyi vaksin dosis status kuning udah bi  httpstcotofljqf;0
myraaznd nahh haritu pergi ambil vaksin;0
dkijakarta vaksin jumat daftar lalu jaki jumat pagi ya;1
plindungi hai kak vaksin vaksinasi massal daerah sertifikat vaksinya aplikasi ya kak biar sertifikat tunggu;0
ni vaksin jarum gede yak yg ga rasa suntik yg kek gigit semut;0
bahaya httpstcodscpufc;1
anies baswedan terbit kepgub panjang ppkm level wfo sektor nonesensial kapasitas persen;0
vaksin kemaren miskom vaksin asli tau gitu kemaren ga marah marah banget yak bareng si adek  ;0
salah wakil vihara duta maitreya pulau riau pesan stok vaksin provinsi batam pulau riau tambah pulau riau salah daerah capai vaksinasi tinggi indonesia;0
vaksin moderna vaksin cm ngilu lengan gk reaksi vaksin ngilu lengan demam pusing capek;1
lengkap ambil vaksin  mufti lantan httpsiftttkuhznh;1
vaksin indonesia bangkit cakiminow halimiskandarnu dpwpkbsumut emhasanuddin imansyukri zeirasalim losomena koorprovsumut sukoyokasekpro;0
tuan haniff undang undang akta raja gunapakai wajib ambil vaksin rakyat undang undang akta ambil vaksin jadi mandatory raja kredit mohd hanizam yunos;1
plindungi admin data ktp aplikasi beda ya sertifikat vaksin masuk mall gak sebab data gak sinkron;0
yayyyyyyyy result test darah normal at last so dah cucuk vaksin yeyeayyyyyy;1
me dah vaksin      beneran nih info vaksin daftarin besok anterin tergercep baik emang;0
sekurangkurangnya remaja umur lingkung terima dos vaksin covid negara malam timbal menteri kesihatan datuk dr noor azmi ghazali vaksincovid kkm keluargamalaysia jabatanpenerangan;1
besok gue vaksin temenya ;1
convomf ga wajib km vaksin gapapa cuman bagai emg mas batas vaksin;1
menteri sains teknologi inovasi mosti mantap ekosistem bangun vaksin negara usaha bangun vaksin keluar tempat menteri datuk seri dr adham baba vaksincovid mosti keluargamalaysia jabatanpenerangan;0
kemenkesri bismillah idzin vaksin derita sakit jantung vaksin rs tmpat kerja mengijinkan vaksin resiko kah;0
ajar marang terima vaksin pfizer httpsmalaysiaaktifmy keluargamalaysia menangbersama lindungdirilindungsemua jabatanpenerangan japentrg;0
cerita ga hehe gue vaksin tp brngkt siang pas sana udh ngantri rame bgt ribut jg tbtb gue panggil tugas kalo gue suruh masuk aja karna undang gue nglewatin kerumun tau ya kek gmn kek c;1
waytotheclty oalaa habis vaksin jan lupa minum paracetamol ya yangg;1
awan radzijidin makan gaji buta tu geng geng ambik vaksin tu;1
pantau vaksin dosis babinsa ceper laku aman httpdlvritslfc;1
jjjjjeonqugk miokfebriani meenteri sehat brazil klo gasalah nolak vaksin tpi masuk acara ;1
vaksin gold bar buka preorder esok sept am limited edition k pcs je harga tahan httpsbitlypgmuseum;0
awan radzijidin kerja kilang swasta kena paksa vaksin vaksin kena buang kerja tu je nk bgtau;1
second dose eh vaksin masuk  risau muka glowing teroxcz lepas fully vax so nak anti    ;1
dennysiregar waspada varian bru yg muncul resisten vaksin;1
convomf iya bude abis positif bulan jadwal vaksin tetep berangkat pas nanya nakesnya udah;1
pantau giat vaksin massal puskesmas karang anyar;0
hmm kalo yg sertif emg susah gatau knp ya gabisa tpi pas udh vaksin cek sertif udh sertif vaksin gatau ngebantu engga hehe moga bantu;1
lepas vaksin nak scam orang ain haahahahahahah geramm;1
ue ue ue udah vaksin trnyata pas suntik ngga sakit ;1
lewat uji efektivitas vaksin pfizer aman anak usia httpstcojcnefg;1
tawar covid is vaksin utk ad vaksin yg betol kesan tu xberjaya it takes years to understand the virus let alone to develop a vaccine yg efecttive;0
org  kantor mu yg sok asa kaya sok pinter der ga dengerin syukur aja dpt vaksin org blm bs dpt vaksin krn;1
masuk pantai marina bayar brp ya syarat masuk aja vaksin g dips;0
wakil menteri uang wamenkeu suahasil nazara belanja prioritas bidang sehat perintah kondisi pandemi covid infrastruktur tenaga sehat dukung sehat vaksin httpskerjhacomempatprioritasbelanjabidangkesehatandimasapandemi jokowi;1
reguleus ya mama nanya vaksin gak dokter langsung periksa dibuatin surat aja sih;0
ngantar opa vaksin alhamdulillah cm tempat dokter praktek apartemen aja;0
kaedah beri vaksin remaja lindungdirilindungsemua negara jkjavmy kkmputrajaya;1
menteri didik dewanrakyat ttg ips institusi didik swasta sekolah rendah tengah tahfiz sop buka sekolah swasta dgn sekolah kjaan ppv pusat vaksin terima sekolah utk mudah ajar ppv awam;1
takut virus nya takut sertifikat orang yg vaksin b  httpstcoltrupvwtpv;0
kemenkes arab saudi izin terima vaksin sinovac laksana umrah syarat penuh jamaah;0
pasien periksa antibody covid kuantitatif udah vaksin x x sinovac x moderna bisab  httpstcoremhalt;1
pusing abis vaksin denger ilichil menang vote mv promotion happy bangettt   ;0
xxi bs vaksin doang ga si;0
nder biasain kayak gin langsung tanggung contoh guru biar kait ngadain vaksin temen tuh info dapet valid hubung badan loh;0
bangprik cek vaksin x x;1
fessponti klo kwn kmek yg nk vaksin nda;1
vaksin nggak jadi nggak nggak dah teambek cuti bangsyat;1
cuti gak plan ngapain vaksin jg dahla tidur ;0
indonesia kn anehyg msk prog vaksin usia alias mahasiswa tp yg suruh kelas offline duluan level sd yg blm vaksin  hadehhh;0
salah banyak org tular vaksin liar prokes m yg ketat korban nyawa mayoritas yg vaksin;1
anxious time nak tunggu gilir nak kena vaksin pakcik jaga p tu tegur senang duduk ;1
dinkesjkt bantu sertifikat blm vaksin agustus smp jalan halimun sdh cek pedulilindungi status vaksin mesti lapor puskessetiabudi;0
sakit kepala ngga ilang ilang abis vaksin yak ;1
waaah cikgu duduk rumah ajar la vaksin pecat je la yg antivax ni kes pasal nak ni;0
unit samapta polsek mergangsan laksana pam giat vaksin tahap gedung serbaguna kel wirogunan tugas vaksin puskesmas kec mergangsan orang target orang rabu;1
