tweet_stemmed;target_new
bmsganyangcovid kulinerpwt sscpurwokerto pwtkotasatria monggo lur vaksin httpstcojgggjzupq;1
ngantuk banget abis vaksin;1
dah vaksin ;1
abg min ngn i vaksin yg for nd dose kekek  kuat jodoh tuu hahha;1
kemaren gua ga vaksin undur suruh nunggu info gua udah ketarketir maleman  ;0
cepat vaksinasi perintah kali sasar jawa untung sambut antusias warga ajar yg bagi dosis vaksin sukseskanvaksinasijawatengah indonesiasehatindonesiahebat;1
warga tanggung cilacap jawa gilir vaksin door to door bukti nyata perintah cepat vaksinasi sukseskanvaksinasijawatengah indonesiasehatindonesiahebat;1
meschach kemarin gue vaksin sakit banget abis vaksin lengan langsung cenat cenut;0
schfess klo pas ptm gada uh gitu ijin vaksin aja nder kmrn kyk temenku ga ptm vaksin ijin;1
bbyoda ya allah gwe bom vaksin   ;0
schfess vaksin sih nder;1
schfess vaksin ptm nya izin;1
vaksin demam ga menggigik ;0
boboiboih barusan abis vaksin ga sakitcuma kaya gigit kingkong aja;1
tp beda sih klo td kasus mas kali vaksin nik pas liat dh vaksin dosis jd kek nik dipake orang vaksin trs tugas klo dh vaksin trs mo vaksin lg ga bs nik nya warna kuning pas cek;0
yuk ragu untul vaksin lagisemoga herd imunity cipta lekas pulih negeri  httpstcorszsbvyk;1
evylagi loh vaksin kena covid;0
hello guys sikit kena nak bebas ni   vaksin peluang jalan hidup bi  httpstcolqizrwvtd;1
lapar lwn antuk judul imbah vaksin ni;1
schfess mending pilih vaksin;1
ayo jateng sehat vaksin sukseskanvaksinasijawatengah indonesiasehatindonesiahebat httpstcooctvzsko;1
pas vaksin az efek gitu nder demam mual diare minggu pas vaksin aman aman aja sih;0
halo min mohon bantu vaksin terbit sertifikat yg yg tanggal jenis vaksin data sedia yg sy laku;0
efek vaksin dosis krasa bgt yah;0
bernamadotcom ismailsabri jkjavmy kkmputrajaya officialmosti pakai vaksin sinovac dgn pfizer kn mudah krja ckit  cepat dn mudah;1
moga proses vaksinasi jalan lancar warga jateng sudab vaksin door to door utk cepat herd imunity semangat perintah sukseskanvaksinasijawatengah indonesiasehatindonesiahebat;1
ngeluarin senjata wajib sertifikat vaksinbiar vaksin dagang laris manis bumnbangkrut  httpstcogwgdufe;1
jais serah nama individu mahu vaksin sultan selangor httpstcoweugyxxt covid jais sultanselangor vaksin;1
vaksin;1
presiden dahulu vaksin aman halal siapsiap jawabet vaksinjokowi erickthohir;1
ribu dosis vaksin corona sunti masyarakat bojonegoro simak lengkap  httpstcoqcrwvoxawk;1
bertanyarl ttapi yg remehin  udh turun udah vaksin jd bebas ga pake prokes;0
pksejahtera nettyheryawan eropa amerika warga tolak vaksin pilih produksi vaksin;0
polrestabessby ayo vaksin;1
windaakaniaa im ffoodfess vaksin;1
vaksin covid jok remaja hik vaksin dengar asyikfm esok pagi dr ana mahat p  httpstcopsgmxvs;1
time teman pi vaksin la bru nak;1
presiden jokowi aju orang terima sunti vaksin covid vaksin ti  httpstcowtcuuiolk;1
schfess vaksin aja nder ijin dlu;1
terima dos vaksin yg sop pulau kawal rapi polis navy rela tempat tumpu airport jetty pantai chenang kuah kalung harga raja rana buka lgk;1
kitaashinsuke waaa congratss tempat kosonh vaksin;0
anjir gue service center;1
warga ajar warga jawa gilir vaksin semangat corona hilang sukseskanvaksinasijawatengah indonesiasehatindonesiahebat;1
klo pas ptm gaada uh yg urgent mending ijin aja tau ak syarat ptm hrus vaksin ya gatau sih  mnurut ak mending vaksin;1
convomf tunggu aja nderr mama ampe hari ga sertif ama disuru vaksin lg;0
schfess abis klo gilir ptm isa tenangg udh vaksin;1
magentatear pon vaksin hm;0
schfess ptm absi vaksin;1
yg depok vaksin  ;1
kali supermaket kali parkir basement kali gagal scan qr code pedulilindungi gak sinyal  udah bikin print out kartu vaksin lupa aja dikantongin pergi;0
anti vaksin beliau ni ;0
schfess vaksin aja ijin mesti kalo urus vaksin;1
malkamal tau barusan ak vaksin kampus yg kek gtu;1
abis vaksin tangan kemeng;1
alhamdulillah nih warga tanggung kedapetan vaksin door to door jawa magelang cilacap nih sukseskanvaksinasijawatengah indonesiasehatindonesiahebat;1
masyarakat sadar betapa vaksin contoh magelang jawa warga antusias denga  httpstcooyyibotzt;1
henrysubiakto vaksin colok hidung pemrintahan baca tweet bingung;0
rentas negeri rentas dearah pn seronok tgok negeri dh blh rentas dearah blh lancong dlm negeri sndriapa lh erti lengkap dose vaksin;0
gopuudd fwbess gantung tuju udh x vaksin ttp pcr urg;0
alhamdulillah udah vaksin moderna x moga ga jd zombie ;1
alhamdulillah uji coba vaksin pfizer aman anakanak httpstcoaqjhomn;1
fslbnjm u too ya lg gaenak badan abis vaksin huhu;0
vaksin ama pcr aja nderr bandara tinggal scan barcode pcr pedulilindungi kalo hasil pcr ga masuk peduli lindung print manual ya nder verifikasi manual;1
kjri barcode vaksin covid indonesia baca sistem arab saudi httpsbaperanewscomkjrisebutbarcodevaksincovidindonesiatakterbacadisistemarabsaudi box misterius erick thohir capai herd immunity pon xx papua;0
alhamdulillah negara sdh vaksin gratis kali kpd rakyat yg akal sehat sukarela vaksin kadrun yg nggak vaksin biar goa;1
hbs vaksin badan sakit flish;0
konsul haji kjri jeddah endang jumali barcode vaksin covid keluar menteri sehat ri baca sistem pindai;0
siap kuliah tatapmuka sampe skrg vaksin mengsedih ;1
kjri barcode vaksin covid indonesia baca sistem arab saudi httpsbaperanewscomkjrisebutbarcodevaksincovidindonesiatakterbacadisistemarabsaudi everysecondwithhyoyeon nestle jkwetmajukankrakatausteel usaha mandiri utksemua stopfitnahfpi percepatkekebalankomunal ppkmmembawadampakbaik;0
askrlfess nggakpapa abis vaksin mandi nder basah bad ;1
moots i dah vaksin takecare korang even dah vaksin ;1
kjri barcode vaksin covid indonesia baca sistem arab saudi httpsbaperanewscomkjrisebutbarcodevaksincovidindonesiatakterbacadisistemarabsaudi ikon made me proud bangga juang syariah megan allrounderjinyoungday bangtan live dakwahsyariahislam tinggal ;0
yudith iya prokes n sgr vaksin jokowi kendali pandemi jokowimampukendalikanpandemi;1
parah bngt gua nyari vaksin kesana untung dapet vaksin ;0
kjri barcode vaksin covid indonesia baca sistem arab saudi httpsbaperanewscomkjrisebutbarcodevaksincovidindonesiatakterbacadisistemarabsaudi syariahsumberkeberkahan lee jeno thank you plnmobile starsforseungmin semuamakinmudah vaksin lindung indonesia partai ;0
btw gue udh vaksin doooong jiahahaha udh bom;1
mak w kasi hadiah abis vaksin nya harga motor beat gin mah w vaksin x jg;1
indonesia terima vaksin covid juta dosis httpsbaperanewscomindonesiakembaliterimavaksincovidsebanyakjutadosis box misterius erick thohir capai herd immunity pon xx papua;1
pls pls nervous banget vaksin;1
dagang pasar tradisional dorong vaksin covid iring geliat aktivitas ekonomi vaksin vaksincovid ekonomi dagang covid lampostco;1
alvinjfr vaksin kga efek;1
indonesia terima vaksin covid juta dosis httpsbaperanewscomindonesiakembaliterimavaksincovidsebanyakjutadosis everysecondwithhyoyeon nestle jkwetmajukankrakatausteel usaha mandiri utksemua stopfitnahfpi percepatkekebalankomunal ppkmmembawadampakbaik;1
ya udah vaksin aduh gimana sih herd immunity nyata perintah doang;1
indonesia terima vaksin covid juta dosis httpsbaperanewscomindonesiakembaliterimavaksincovidsebanyakjutadosis ikon made me proud bangga juang syariah megan allrounderjinyoungday bangtan live dakwahsyariahislam tinggal ;1
warga tanggung cilacap jawa kedapetan gilir vaksin door to door bukti nyata perintah cepat vaksinasi sukseskanvaksinasijawatengah indonesiasehatindonesiahebat;1
ahli ui ramal gelombang tiga covid ri desember;1
sridianava surat bukti cinta aja gak kog yg cinta gitu vaksin gak imun;1
chudine bangdul bang nanya sya hbis vaksin sinovac nyeri dada udah hrian takut;0
vaksin wajib  vaksin takut ngga ngegym   httpstcooyyxaik;0
overtee cuman kartu vaksin ;1
ibuk kesambet vaksin dah ayo ayo in ngasih babibu ga gubris pagi pagi tibatiba semangat vaksi;1
kaya vaksin langsung demam pusing rawan marah marah gakjelas;1
giat vaksin merdeka wilayah polsek cilaku polres cianjur utk kurang covid;1
khansaadn im ffoodfess cium aneh vaksin worry vaksin huhu;0
ccalmvne kayak emg bawa efek vaksin;1
timpalbali dm aja kalo butuh info vaksin daerah gianyar     ;1
humasrespasbar ayo vaksin;1
besok vaksin ;1
screening vaksin  siang cek ya  iyaa kak lu anak umj ya  hah iyaa tau  iyaa kaya  httpstcoqjbacaxl;1
ih gua kmrin kn vaksin tuh besok vaksin;0
habis vaksin ngantoook;1
kkjrrr vaksin;1
buruburu vaksin dosis ngehindarin pcr moga ga sakit biar pas rapid ga reaktif ;1
giat vaksin merdeka wilayah polsek cilaku polres cianjur utk kurang covid;1
hahamarrr tah ah taktau ah yg tau nak vaksin;1
drkiesx kemarin gua vaksin ga;1
giat vaksin merdeka wilayah polsek cilaku polres cianjur utk kurang covid;1
lengah jumawa taat prokes m ya sdh vaksin vaksinasi yaa yuk in  httpstcoojrnqvx;1
pejam dh vaksin hahahah semut gigit sakit;1
harap suntik vaksin masyarakat kabupaten tegal bantu perintah rang angka covid percepatkekebalankomunal capai herd immunity;1
banxnamilkkk nad panik tensi ga vaksin;1
polres tegal kodim tegal organisasi masyarakat projo universitas bhamada slawi selenggara giat vaksin covid gedung yaum slawi kabupaten tegal percepatkekebalankomunal capai herd immunity;1
jellycanddy kak dada nyeri hbis vaksin kmrin kakak gmna biar sembuh ;0
plindungi udah bulan email sertifikat vaksin garagara sertifikat gue salah sampe b  httpstcodzycxamst;0
purwaningrum patuh prokes jgn lupa vaksin jokowi kendali pandemi  httpstcoaujnrpckr;1
kapolsek sungai tarab iptu irwan ali sh personil sosialisasi ajar nya vaksin tingkat imun tubuh polrestanahdatar humaspolrestanahdatar;1
badan enak habis vaksin kemarin  ;0
cakap jelah vaksin based on appointment date susah scheduled walkin la fakehope je walk in;0
hallo min sertifikat vaksin amp salah data tanggal lahir email tp balas gimana ya plindungi;0
nder vaksin jam rumah jam langsung mandi keramas ndak lengan ndak kenapanapa ndak takut;1
vaksin gel bgt;0
plindungi ka nik orangtua daftar sertifikat vaksin bener nik nya setrifikat vaksin gabisa muncul;0
vaksin sinovac emang efek bikin laper kah;1
fwbess vaksin pcr klo aman vaksin fullll;1
efek samping vaksin emng bikin demam amp pusing bgini;0
rasa gel nya habis vaksin;0
yaallah umum ambil formulir vaksin aja udah pingsan kalo pas vaksin pingsan malu banget sih   ;0
vaksin dtg makan wc order makan wkwk;1
turun laju infeksi covid putus mata rantai pandemi covid lindung generasi derita infeksi covid vaksin percepatkekebalankomunal capai herd immunity;1
nak kes terima vaksin sinovac walkin first dose dkt klcc tp due dos klcc dh tutup ada trikh mysejahtera;0
iyaa imun orang beda temenku yg vaksin bareng efek neng makan mamah gak ngerasain apaapa ya bapak pas vaksin imun bagus kayak mamah;1
spicenesia temenku vaksin moderna demam nak ;0
maap nanya gua daftar vaksin careprotect ya pas daftar nik udah daftar gua ga daftar vaksin karna nunggu selesai abis kena covid nik dipake orang;0
nd dose vaksin ni effect demam;0
ruruxbutterfly hbs gada vaksin ;0
masak iya masuk indomaret aja pake sertifikat vaksin;0
doa orang beli sijil vaksin palsu kena scam;0
oke chudey i got fully vaccinated with the same astrazenecca yg lucu w vaksin efek gatel w pikir psoriasis dokter kulit w ternyta efek vaksin;1
sinaronline ambil vaksin senang free je;1
manfaat vaksin covid salah satu cegah virus corona sebar mungkin mutasi kebal vaksin percepatkekebalankomunal capai herd immunity;1
veritasardentur jam vaksin az gatal leher badan malam paha lengan bidur pagi hilang tp gatal yg pindah kaki tangan merah;0
vaksin pecat kalah udah joseph stalin kelen dipaksavaksin vaksinataupecat;1
pupmiaw positif c word gue online trs gue blm vaksin;1
lepas bawa anak cucuk vaksin mrr janganpembaris;1
taharudddin bangzhack iya deeehtunggu vaksin nusantara aja;1
gue ribut ma temen gegara bahas twt nicky yg temennya yg habis vaksin testis nya bengkak capek bgt gue ngasih erti;0
ashikinnazron amirahnajwaaaa qilae dah locked ni tunggu tarikh je ni hihi  cepat amik vaksin;1
btw vaksin gaiso melbu indomerot ;0
harap depan tingkat akselerasi vaksinasi target presiden joko widodo hari juta vaksin wujud percepatkekebalankomunal capai herd immunity;1
dandunk iya kerumun vaksin gada klusternya kek krl ;0
sinaronline vaksin haramsogok duit haram pulak;0
vaksin covid manfaat lindung tubuh jatuh sakit akibat covid timbul kebal spesifik tubuh percepatkekebalankomunal capai herd immunity;1
bosen acara tv bayar acara tv lokal putar covid melulu klo ngga vaksin;0
seofucker sial je benda camni cikgu nak urus literally pergi je vaksin tu;0
ayo pakai masker ayo vaksin humaspolri poldasulsel poldasulsel indopol httpstcoyoocbqvp;1
kemenkes arab saudi izin terima vaksin sinovac laksana umrah syarat penuh jamaah;1
memeng vaksin free dedah dgn harga vaksin yg raja org sarawak madah sikda brg free dlm dunia tok nak free ya sedekah muka nak sedekah vaksin hahahahah;0
spicenesia ngantuk sih gak parah vaksin  nek kemeng iya sinovac gak parah moderna astrazeneca;1
polri gelar vaksinasi massal dosis gerai vaksinasi masyarakat vaksin covid gratis percepatkekebalankomunal capai herd immunity;1
wakapolda tinjau laksana vaksin upaya tekan sebar covid patuh atu  httpstcoxqhqevcdr;1
abis vaksin wajib nongkrong sih;1
vaksin covid manfaat lindung tubuh jatuh sakit akibat covid timbul kebal spesifik tubuh percepatkekebalankomunal capai herd immunity;1
vaksin nyeri nya asa banget ya;0
turun laju infeksi covid putus mata rantai pandemi covid lindung generasi derita infeksi covid vaksin percepatkekebalankomunal capai herd immunity;1
serius la budak skola da dbuka utk vaksin penuh ppv weyhsop da soup;0
imthebadguywut symptoms kuat tu hilang dia family kau dah vaksin kecuali adik adik la;0
vaksin geter geter;0
bluejeanshitam iya bener gak pikir krn kerumun krn vaksin gak anggap kerumun sih  ;0
polres tegal kodim tegal organisasi masyarakat projo universitas bhamada slawi selenggara giat vaksin covid gedung yaum slawi kabupaten tegal percepatkekebalankomunal capai herd immunity;1
daerah gw rakyat yg antusias vaksin dimanfaatin oknum kutip warga heran warga nurut aja;0
polres tegal kodim tegal organisasi masyarakat projo universitas bhamada slawi selenggara giat vaksin covid gedung yaum slawi kabupaten tegal percepatkekebalankomunal capai herd immunity;1
polres tegal kodim tegal organisasi masyarakat projo universitas bhamada slawi selenggara giat vaksin covid gedung yaum slawi kabupaten tegal percepatkekebalankomunal capai herd immunity;1
polres tegal kodim tegal organisasi masyarakat projo universitas bhamada slawi selenggara giat vaksin covid gedung yaum slawi kabupaten tegal percepatkekebalankomunal capai herd immunity;1
vaksin covid manfaat lindung tubuh jatuh sakit akibat covid timbul kebal spesifik tubuh percepatkekebalankomunal capai herd immunity;1
raja lembut golong antivaksin httpstcoedobqbqdf;0
polres tegal kodim tegal organisasi masyarakat projo universitas bhamada slawi selenggara giat vaksin covid gedung yaum slawi kabupaten tegal percepatkekebalankomunal capai herd immunity;1
kompastv kalo vaksin efikasinya rendah giat yg kalo onlen mah mending onlen;1
polres tegal kodim tegal organisasi masyarakat projo universitas bhamada slawi selenggara giat vaksin covid gedung yaum slawi kabupaten tegal percepatkekebalankomunal capai herd immunity;1
durex size kecik kecik width while one condom width kecik is pakai durex sbb longgar ;0
vaksin gak asa wkwk;0
mo pamer kartu vaksin dr dlu tpiii nama peduli lindung salahhh hm;0
polres tegal kodim tegal organisasi masyarakat projo universitas bhamada slawi selenggara giat vaksin covid gedung yaum slawi kabupaten tegal percepatkekebalankomunal capai herd immunity;1
habis vaksin yeay;1
polres tegal kodim tegal organisasi masyarakat projo universitas bhamada slawi selenggara giat vaksin covid gedung yaum slawi kabupaten tegal percepatkekebalankomunal capai herd immunity;1
polres tegal kodim tegal organisasi masyarakat projo universitas bhamada slawi selenggara giat vaksin covid gedung yaum slawi kabupaten tegal percepatkekebalankomunal capai herd immunity;1
manfaat vaksin covid salah satu cegah virus corona sebar mungkin mutasi kebal vaksin percepatkekebalankomunal capai herd immunity;1
polres tegal kodim tegal organisasi masyarakat projo universitas bhamada slawi selenggara giat vaksin covid gedung yaum slawi kabupaten tegal percepatkekebalankomunal capai herd immunity;1
habis vaksin langsung marathon gmeet   ;1
udah vaksin keduaaa yeeeeeeyyyyy;1
senarai nama guru kafa pegawai masjid jurunikah enggan terima sunti vaksin sembah sultan selangor sultan sharafuddin idris shah jais;0
vaksin dosis ga sakit kann;1
morkleyshaa enggaaa soalny uda vaksin xixi;1
tribunnews kadrun yg takut vaksinkrn suara musik;0
jaemcityx plng vaksin makji  jdi blm makn siang;1
kumpar vaksin siswa wilayah jateng minim piye mas ganjarpranowo;0
besok vaksin moga gak efek demam dll hehe;1
onuonuochii naam habis vaksin ni bos;1
vaksin dosis aja efek uda lemes bgttt;0
ayinanat ye do tengok en sekolah orang manage pasal tarikh vaksin ni ;0
ltnelcy bokap gw efek samping pusing ngantukan bae trus senin kmren tmn gw vaksin efek samping nya ngantuk;0
kmrn ajak vaksin gak skrg gilir cpns butuh banget nyari dah dibilangin butuh sertifikat vaksin ;0
manggaa vaksin daerah bandung niiih;1
abis vaksin lemes bgt ya;0
ragu vaksin vaksin akh vaksin polisi capai herd i  httpstcocieroeccyq;1
anggadiredja wajar jabat kaya klinik rumah anggota dewan kemarin tes ce pe en  httpstcoblrnnnip;0
aduh males bsk vaksin;0
redtcha kampus ngedata yg dah vaksin yg belomtakut banget beneran offline;0
vaksin dada bgt asli;0
pamer udh vaksin panik pas suntik haha thx motivator vaksin ku  fajriunty  httpstcodvqriniqo;1
kaitoalex vaksin broooo;1
vaksin ubah apaapa sih gel dikit tangan habis dipukulpukul kali eh langsung ilang gel;1
tangan sy gk bs gerakin abis vaksin;0
alhamdulillah abis vaksin dosis w ga demam ga pusing ga lengan w kenceng bgt sa  httpstcookxunu;1
vaksin x protokol sehat jalan jaga keluarga risiko pen  httpstcorosorokqk;1
dah tarikh vaksin;1
polri gelar vaksinasi massal dosis gerai vaksinasi masyarakat vaksin covid gratis percepatkekebalankomunal capai herd immunity;1
ka kemaren aja vaksin pulang rumah mba tau kalo abis vaksin bilang lu mati abis vaksin ngga deket orang abis vaksin hina sampek ngga deket ;0
biasa alergi eh abis vaksin jg bentol alergi thanks world;0
atus populasi dewasa terima sekurangkurangnya dos vaksin awaninews awan malaysiasihat;1
askrlfess nder yg vaksin sblm yg stok vaksin aja jgn lupa cerita dokter yg vaksin aja;1
plindungi vaksin jumat tp sertifikat vaksin blm muncul aplikasi ya faskes arah arah faskes sertifikat vaksin aplikasi butuh mohon bantu;0
hepihost langgar uu lintas gak vaksin;0
singapore cerah covid kila dah vaksin x tetep semangat slalu waspada;1
askrlfess sembuh tengah juli kemaren september udah vaksin dosis ;1
fplucu untung udh vaksin;1
sempet pesimis gak vaksin hipertensi alhamdulillah tensi turun;1
eh helloooo tunggu la habis vaksin isnin depey gitu doh mggu tu kito gi la sep mung free ko mggu tu;1
kepinhln mantap pin plus abis vaksin;1
manfaat vaksin covid salah satu cegah virus corona sebar mungkin mutasi kebal vaksin percepatkekebalankomunal capai herd immunity;1
pantes aja badan remuk banget kemaren efek vaksin eh tambah haid  double kill sksjhsksksd;0
polri gelar vaksinasi massal dosis gerai vaksinasi masyarakat vaksin covid gratis percepatkekebalankomunal capai herd immunity;1
nak bawak adik walkin ppv nak vaksin antivaksin sia   ;0
polri gelar vaksinasi massal dosis gerai vaksinasi masyarakat vaksin covid gratis percepatkekebalankomunal capai herd immunity;1
manfaat vaksin covid salah satu cegah virus corona sebar mungkin mutasi kebal vaksin percepatkekebalankomunal capai herd immunity;1
panik sih kartu vaksin ilang sertifikat vaksin bom ;0
polri gelar vaksinasi massal dosis gerai vaksinasi masyarakat vaksin covid gratis percepatkekebalankomunal capai herd immunity;1
vaksin covid manfaat lindung tubuh jatuh sakit akibat covid timbul kebal spesifik tubuh percepatkekebalankomunal capai herd immunity;1
polri gelar vaksinasi massal dosis gerai vaksinasi masyarakat vaksin covid gratis percepatkekebalankomunal capai herd immunity;1
polri gelar vaksinasi massal dosis gerai vaksinasi masyarakat vaksin covid gratis percepatkekebalankomunal capai herd immunity;1
polri gelar vaksinasi massal dosis gerai vaksinasi masyarakat vaksin covid gratis percepatkekebalankomunal capai herd immunity;1
abekang bantu vaksin jgn salah  ;0
rxelana ngeterne bos aris vaksin ;1
polri gelar vaksinasi massal dosis gerai vaksinasi masyarakat vaksin covid gratis percepatkekebalankomunal capai herd immunity;1
partonoadjem henrysubiakto udah vaksin suruh pake masker tuju vaksin ga da  httpstcojoxcuol;0
selesai vaksin dosis;1
polri gelar vaksinasi massal dosis gerai vaksinasi masyarakat vaksin covid gratis percepatkekebalankomunal capai herd immunity;1
polri gelar vaksinasi massal dosis gerai vaksinasi masyarakat vaksin covid gratis percepatkekebalankomunal capai herd immunity;1
udh vaksin;1
bloeybaekki pen vaksin tp klo udh vaksin kudu istirahat;1
habis vaksin ni lengen gel bgt;1
babih penat la gelak dgn taklimat vaksin ni;0
polri gelar vaksinasi massal dosis gerai vaksinasi masyarakat vaksin covid gratis percepatkekebalankomunal capai herd immunity;1
sertifikat vaksin dah dapet gak ngurusin ;1
cintada klo ga salah pulau provokator anti vaksinitu pertiwi menko polhukam;0
vaksin kemaren kena cvd ;1
polri gelar vaksinasi massal dosis gerai vaksinasi masyarakat vaksin covid gratis percepatkekebalankomunal capai herd immunity;1
vaksin covid manfaat lindung tubuh jatuh sakit akibat covid timbul kebal spesifik tubuh percepatkekebalankomunal capai herd immunity;1
seronok je lahai tengok orang pergi vaksin ramai ramai ni haish sorang je dewan tu dah la dewan tu gelap ;0
vaksin covid manfaat lindung tubuh jatuh sakit akibat covid timbul kebal spesifik tubuh percepatkekebalankomunal capai herd immunity;1
vaksin covid manfaat lindung tubuh jatuh sakit akibat covid timbul kebal spesifik tubuh percepatkekebalankomunal capai herd immunity;1
ngantuk ngga tidur emang efek vaksin sengaja tidur telat ju  httpstcohioelwblvu;1
hawa adem aku ngantuk banget abis vaksin;1
vaksin covid manfaat lindung tubuh jatuh sakit akibat covid timbul kebal spesifik tubuh percepatkekebalankomunal capai herd immunity;1
vaksin covid manfaat lindung tubuh jatuh sakit akibat covid timbul kebal spesifik tubuh percepatkekebalankomunal capai herd immunity;1
vaksin covid manfaat lindung tubuh jatuh sakit akibat covid timbul kebal spesifik tubuh percepatkekebalankomunal capai herd immunity;1
manfaat vaksin covid salah satu cegah virus corona sebar mungkin mutasi kebal vaksin percepatkekebalankomunal capai herd immunity;1
halo habis vaksin;1
yes and my lil sister perli dptkan surat dr sekolah yg susun atur jadual murid mendapatkam vaksin;1
vaksin covid manfaat lindung tubuh jatuh sakit akibat covid timbul kebal spesifik tubuh percepatkekebalankomunal capai herd immunity;1
turun laju infeksi covid putus mata rantai pandemi covid lindung generasi derita infeksi covid vaksin percepatkekebalankomunal capai herd immunity;1
vaksin covid manfaat lindung tubuh jatuh sakit akibat covid timbul kebal spesifik tubuh percepatkekebalankomunal capai herd immunity;1
kai minn ka jarak antigeen kartu vaksin min  ;0
cybsquad drkoko alhamdulillahmak istiqamah no vaksin terimakasih ya allah  ;1
selamat siang plindungi vaksin tanggal agustus sertifikat ga vaksin tanggal september vaksin gimana ya sertifikat vaksin;0
vaksin covid manfaat lindung tubuh jatuh sakit akibat covid timbul kebal spesifik tubuh percepatkekebalankomunal capai herd immunity;1
bustomi yoiii kalo yg ngajak langsung gasss udh sertifikat vaksin  ;1
jatah vaksin kmrn kosong jadwal mundur jadwal tensi bgt jadwal ulang   bojoku yo oppsehh;0
vaksin drama kk;1
vaksin covid manfaat lindung tubuh jatuh sakit akibat covid timbul kebal spesifik tubuh percepatkekebalankomunal capai herd immunity;1
benda doktor dzul oi ni vaksin toksin elok awak pegang jawat lg tp adham baba n kj tu bagus awak org sungguh kecewa;0
areajulid alhamdulillah yuk vaksin biar cepat bebas covidnya httpstcoelgckwka;1
manfaat vaksin covid salah satu cegah virus corona sebar mungkin mutasi kebal vaksin percepatkekebalankomunal capai herd immunity;1
iya maksud massal vaksin lanjut massal jg tp kalo lewat gitu takut suruh vaksin lg mangkanya puskesmas dekat gmn jelas biar tau;1
itsnayoon sakit bener kebas jg sempet pusing jg pas vaksin aja kaya ga asa vaksin wkwkwk;1
habis suntik vaksin sinovak;1
manfaat vaksin covid salah satu cegah virus corona sebar mungkin mutasi kebal vaksin percepatkekebalankomunal capai herd immunity;1
gk telat utk vaksin msh bs nonton sangchi jg km krn film marvel rada nongkrongnya bioskop black widow aja blm sampe skrg d pdhl dah bgt otomatis sangchi jg mgkn nunggu bln hiksss  ;1
 why is the holiday over  the holiday overlapped with the second round of vaccine so im in pain for two days   ill cheer up from today  monbebe take a rest until today aww minhyuk  and pls why is speaking so cutely imma cry ;1
manfaat vaksin covid salah satu cegah virus corona sebar mungkin mutasi kebal vaksin percepatkekebalankomunal capai herd immunity;1
gak daftar wkwkw vaksin gw polda vaksin keliling trus pas udh dosis gw vaksin puskesmas eh situ tulis vaksin pdhl udah pas cek ga daftar gaada data;0
ygelies aseekkk semangat nih disiplin prokes vaksin   jokowimampukendalikanpandemi;1
kemarin nd dose vaksin moderna efek samping asa after jam;1
bapak dapet hidayah ken vaksin;1
coba daftar vaksin aja ngga pa pas screening bilang lg konsumsi obat vaksin pa engga kasih tau vaksin engga;1
